### ISSUE TITLE
[BUG] connect to cve-search server on custom port 5000  not working 

### ISSUE THREAD

**Issue by schka17** [OCSInventory-NG/OCSInventory-ocsreports#1080]
**OCS Inventory version**
Version : 2.8 latest docker image

**Describe the bug**
trying to run the command

`cd /usr/share/ocsinventory-reports/ocsreports/crontab/ && /usr/bin/php73 cron_cve.php`

get error:

`https://guardian:5000 is not reachable.`

**To Reproduce**
1. Open shell in container
2. run command `cd /usr/share/ocsinventory-reports/ocsreports/crontab/ && /usr/bin/php73 cron_cve.php`
3. See error
`https://guardian:5000/ is not reachable.`

**Expected behavior**
Downloads of CVE's should start.
for testing purposes i defined https://cve.circl.lu/ as CVE_Search_host, this works

https://guardian:5000/ is reachable within the ocsserver container, tried ping and curl, connect with a client to cve-search server, working.

**Screenshots**

**Log file (optional)**
TCPDUMP

`14:44:45.918835 IP (tos 0x0, ttl 64, id 64167, offset 0, flags [DF], proto TCP (6), length 60)
    192.168.112.1.37452 > 192.168.112.4.5000: Flags [S], cksum 0x6185 (incorrect -> 0xbd77), seq 1911782847, win 64240, options [mss 1460,sackOK,TS val 2637560707 ecr 0,nop,wscale 7], length 0
14:44:45.918872 IP (tos 0x0, ttl 64, id 0, offset 0, flags [DF], proto TCP (6), length 60)
    192.168.112.4.5000 > 192.168.112.1.37452: Flags [S.], cksum 0x6185 (incorrect -> 0xf998), seq 656664359, ack 1911782848, win 65160, options [mss 1460,sackOK,TS val 2561546556 ecr 2637560707,nop,wscale 7], length 0
14:44:45.918891 IP (tos 0x0, ttl 64, id 64168, offset 0, flags [DF], proto TCP (6), length 52)
    192.168.112.1.37452 > 192.168.112.4.5000: Flags [.], cksum 0x617d (incorrect -> 0x24f8), ack 1, win 502, options [nop,nop,TS val 2637560707 ecr 2561546556], length 0
14:44:46.039565 IP (tos 0x0, ttl 64, id 64169, offset 0, flags [DF], proto TCP (6), length 242)
    192.168.112.1.37452 > 192.168.112.4.5000: Flags [P.], cksum 0x623b (incorrect -> 0xd3ec), seq 1:191, ack 1, win 502, options [nop,nop,TS val 2637560828 ecr 2561546556], length 190
14:44:46.039599 IP (tos 0x0, ttl 64, id 10562, offset 0, flags [DF], proto TCP (6), length 52)
    192.168.112.4.5000 > 192.168.112.1.37452: Flags [.], cksum 0x617d (incorrect -> 0x2342), ack 191, win 508, options [nop,nop,TS val 2561546677 ecr 2637560828], length 0
14:44:46.045930 IP (tos 0x0, ttl 64, id 10563, offset 0, flags [DF], proto TCP (6), length 2178)
    192.168.112.4.5000 > 192.168.112.1.37452: Flags [P.], cksum 0x69cb (incorrect -> 0xd566), seq 1:2127, ack 191, win 508, options [nop,nop,TS val 2561546683 ecr 2637560828], length 2126
14:44:46.045947 IP (tos 0x0, ttl 64, id 64170, offset 0, flags [DF], proto TCP (6), length 52)
    192.168.112.1.37452 > 192.168.112.4.5000: Flags [.], cksum 0x617d (incorrect -> 0x1aef), ack 2127, win 501, options [nop,nop,TS val 2637560834 ecr 2561546683], length 0
14:44:46.047129 IP (tos 0x0, ttl 64, id 64171, offset 0, flags [DF], proto TCP (6), length 59)
    192.168.112.1.37452 > 192.168.112.4.5000: Flags [P.], cksum 0x6184 (incorrect -> 0xd0d9), seq 191:198, ack 2127, win 501, options [nop,nop,TS val 2637560835 ecr 2561546683], length 7
14:44:46.047320 IP (tos 0x0, ttl 64, id 64172, offset 0, flags [DF], proto TCP (6), length 52)
    192.168.112.1.37452 > 192.168.112.4.5000: Flags [F.], cksum 0x617d (incorrect -> 0x1ae5), seq 198, ack 2127, win 501, options [nop,nop,TS val 2637560836 ecr 2561546683], length 0
14:44:46.047599 IP (tos 0x0, ttl 64, id 10565, offset 0, flags [DF], proto TCP (6), length 52)
    192.168.112.4.5000 > 192.168.112.1.37452: Flags [F.], cksum 0x617d (incorrect -> 0x1adc), seq 2127, ack 199, win 508, options [nop,nop,TS val 2561546685 ecr 2637560835], length 0
14:44:46.047618 IP (tos 0x0, ttl 64, id 64173, offset 0, flags [DF], proto TCP (6), length 52)
    192.168.112.1.37452 > 192.168.112.4.5000: Flags [.], cksum 0x617d (incorrect -> 0x1ae2), ack 2128, win 501, options [nop,nop,TS val 2637560836 ecr 2561546685], length 0
`

and in the logfile of the cve-search server there is the message
`
2020-11-28 13:46:59,171 - SSL Error on 12 ('192.168.112.1', 37492): [SSL: TLSV1_ALERT_UNKNOWN_CA] tlsv1 alert unknown ca (_ssl.c:1122)`

**Comment by gillesdubois** [comment]
Hi @schka17 

It seems to me that the certificate is not recognized : 2020-11-28 13:46:59,171 - SSL Error on 12 ('192.168.112.1', 37492): [SSL: TLSV1_ALERT_UNKNOWN_CA] tlsv1 alert unknown ca (_ssl.c:1122)

You should try to install the CVE Search certificate on your OCS Server.

Regards,
Gilles.

**Comment by RudyLaurent** [comment]
Hi @schka17,

This message can appear if you use a self-signed certificate.
Try adding these lines at the line 27 in `crontab/cron_cve.php` and at the line 254 in `require/cve/Cve.php` :
```
curl_setopt($curl, CURLOPT_SSL_VERIFYHOST, false);
curl_setopt($curl, CURLOPT_SSL_VERIFYPEER, false);
```

Regards,
Rudy
